{
  "$schema": "http://json-schema.org/draft-07/schema#",
  "$id": "https://raw.githubusercontent.com/aitasadduq/aynama-prayer-times/main/test-vectors/schema.json",
  "title": "Prayer Times Test Vector",
  "description": "Validates prayer-times test vector files under test-vectors/prayer-times/. Enforced by the `vectors` job in .github/workflows/ios.yml, which runs scripts/validate-vectors.py on every commit that touches a vector.",
  "type": "object",
  "required": ["method", "tolerance_minutes", "reference", "cases"],
  "additionalProperties": false,
  "properties": {
    "method": {
      "type": "string",
      "enum": [
        "MWL",
        "ISNA",
        "UMM_AL_QURA",
        "EGYPTIAN",
        "KARACHI",
        "TEHRAN",
        "GULF",
        "DUBAI",
        "KUWAIT",
        "QATAR",
        "SINGAPORE",
        "FRANCE",
        "TURKEY",
        "MOON_SIGHTING_COMMITTEE"
      ]
    },
    "tolerance_minutes": {
      "type": "integer",
      "minimum": 1,
      "maximum": 5
    },
    "reference": {
      "type": "string",
      "minLength": 1
    },
    "cases": {
      "type": "array",
      "minItems": 1,
      "items": {
        "type": "object",
        "required": ["input", "expected"],
        "additionalProperties": false,
        "properties": {
          "description": {
            "type": "string"
          },
          "input": {
            "type": "object",
            "required": ["latitude", "longitude", "date", "timezone"],
            "additionalProperties": false,
            "properties": {
              "latitude": {
                "type": "number",
                "minimum": -90,
                "maximum": 90
              },
              "longitude": {
                "type": "number",
                "minimum": -180,
                "maximum": 180
              },
              "date": {
                "type": "string",
                "pattern": "^\\d{4}-(?:0[1-9]|1[0-2])-(?:0[1-9]|[12]\\d|3[01])$"
              },
              "timezone": {
                "type": "string",
                "minLength": 1
              },
              "elevation_meters": {
                "type": "number",
                "minimum": 0
              }
            }
          },
          "expected": {
            "type": "object",
            "required": [
              "fajr",
              "sunrise",
              "dhuhr",
              "asr_shafii",
              "asr_hanafi",
              "maghrib",
              "isha"
            ],
            "additionalProperties": false,
            "properties": {
              "fajr":       { "type": "string", "pattern": "^(?:[01]\\d|2[0-3]):[0-5]\\d$" },
              "sunrise":    { "type": "string", "pattern": "^(?:[01]\\d|2[0-3]):[0-5]\\d$" },
              "dhuhr":      { "type": "string", "pattern": "^(?:[01]\\d|2[0-3]):[0-5]\\d$" },
              "asr_shafii": { "type": "string", "pattern": "^(?:[01]\\d|2[0-3]):[0-5]\\d$" },
              "asr_hanafi": { "type": "string", "pattern": "^(?:[01]\\d|2[0-3]):[0-5]\\d$" },
              "maghrib":    { "type": "string", "pattern": "^(?:[01]\\d|2[0-3]):[0-5]\\d$" },
              "isha":       { "type": "string", "pattern": "^(?:[01]\\d|2[0-3]):[0-5]\\d$" }
            }
          }
        }
      }
    }
  }
}
