{
  "method": "EGYPTIAN",
  "tolerance_minutes": 1,
  "reference": "Adhan-Kotlin com.batoulapps.adhan:adhan:1.2.1",
  "cases": [
    {
      "description": "Cairo, Egypt \u2014 autumn equinox",
      "input": {
        "latitude": 30.0444,
        "longitude": 31.2357,
        "date": "2026-09-23",
        "timezone": "Africa/Cairo"
      },
      "expected": {
        "fajr": "05:17",
        "sunrise": "06:44",
        "dhuhr": "12:48",
        "asr_shafii": "16:14",
        "asr_hanafi": "17:08",
        "maghrib": "18:51",
        "isha": "20:08"
      }
    }
  ]
}
