{
  "method": "KARACHI",
  "tolerance_minutes": 1,
  "reference": "Adhan-Kotlin com.batoulapps.adhan:adhan:1.2.1",
  "cases": [
    {
      "description": "Karachi, Pakistan \u2014 winter solstice",
      "input": {
        "latitude": 24.8607,
        "longitude": 67.0011,
        "date": "2026-12-21",
        "timezone": "Asia/Karachi"
      },
      "expected": {
        "fajr": "05:51",
        "sunrise": "07:12",
        "dhuhr": "12:31",
        "asr_shafii": "15:28",
        "asr_hanafi": "16:12",
        "maghrib": "17:48",
        "isha": "19:09"
      }
    }
  ]
}
